{
  "schema_version": "ghostlight.coordinator_artifact.v0",
  "artifact_id": "coordinator.cold_wake.sanctuary_intake.v0",
  "review_status": "accepted_as_draft",
  "fixture_lane": "historical_grounded",
  "canon_status": "single_history",
  "source_refs": [
    {
      "ref_id": "cw_grounding",
      "path": "examples/lore-grounding/cold-wake-panic.ganymede-corridor.json",
      "purpose": "Grounds the sanctuary intake scene in Cold Wake corridor pressures."
    },
    {
      "ref_id": "cw_fixture",
      "path": "examples/agent-state.cold-wake-story-lab.json",
      "purpose": "Provides scene, agent, relationship, memory, and object state."
    }
  ],
  "input_refs": {
    "agent_state_ref": "examples/agent-state.cold-wake-story-lab.json",
    "lore_grounding_refs": [
      "examples/lore-grounding/cold-wake-panic.ganymede-corridor.json"
    ],
    "prior_artifact_refs": [
      "experiments/ink/cold-wake-sanctuary-intake-qwen-sequential-v10-no-think.capture.json"
    ],
    "projected_context_refs": [
      "examples/projected-contexts/scene-02-sanctuary-intake.maer_tidecall.projected-context.json",
      "examples/projected-contexts/scene-02-sanctuary-intake.sella_ren.projected-context.json"
    ],
    "ink_refs": [
      "examples/ink/cold-wake-sanctuary-intake.qwen-sequential-v10.ink"
    ],
    "item_manifest_refs": []
  },
  "scene_context": {
    "scene_id": "scene-02-sanctuary-intake",
    "sequence_marker": "after Maer brings a corrupted packet to the sanctuary intake desk",
    "location_id": "ganymede_corridor.sanctuary_intake",
    "participant_ids": [
      "maer_tidecall",
      "sella_ren"
    ],
    "active_object_ids": [
      "corrupted_distress_packet"
    ],
    "active_resource_ids": [
      "sanctuary_bed_capacity",
      "ledger_backing"
    ],
    "public_facts": [
      {
        "text": "The sanctuary has limited capacity and must decide whether a corrupted packet represents a claimant worth intake resources.",
        "refs": [
          "cw_grounding",
          "cw_fixture"
        ]
      }
    ],
    "scene_pressure": [
      {
        "text": "Maer carries Navigator rescue obligation; Sella carries triage obligation and must not let mercy theater bankrupt the clinic.",
        "refs": [
          "cw_grounding",
          "cw_fixture"
        ]
      }
    ]
  },
  "coordinator_decision": {
    "decision_id": "decision.sanctuary.packet_assessment",
    "selected_next_beat": "Maer exposes enough packet evidence for Sella to evaluate the intake risk without pretending personhood is proven.",
    "selected_acting_agent_id": "maer_tidecall",
    "candidate_next_beats": [
      {
        "choice_id": "beat.show_packet",
        "summary": "Maer routes the packet through the shared clinic display and asks Sella to judge the math.",
        "status": "selected",
        "reason": "Keeps Maer embodied as a Navigator using mixed wet/dry interface affordances and preserves Sella's authority."
      },
      {
        "choice_id": "beat.argue_personhood",
        "summary": "Maer argues that the packet is definitely a person.",
        "status": "rejected",
        "reason": "Would collapse the unresolved claimant status and overclaim evidence."
      }
    ],
    "rationale": "The scene needs pressure without false certainty: Maer should act from obligation and evidence, while Sella should retain triage authority and room to distrust the packet.",
    "glue_prose": "The intake desk did not become kinder because a Navigator arrived with a grief-shaped packet. It became more expensive.",
    "glue_prose_status": "accepted_as_narration"
  },
  "machinery_plan": {
    "invocations": [
      {
        "invocation_id": "invoke.project.maer",
        "organ": "projector",
        "purpose": "Compile Maer-local operating context for the action choice.",
        "input_refs": [
          "examples/agent-state.cold-wake-story-lab.json"
        ],
        "output_refs": [
          "examples/projected-contexts/scene-02-sanctuary-intake.maer_tidecall.projected-context.json"
        ],
        "status": "accepted"
      },
      {
        "invocation_id": "invoke.respond.sella",
        "organ": "sandboxed_responder",
        "purpose": "Generate Sella's local response from projected context and the visible packet action.",
        "input_refs": [
          "examples/projected-contexts/scene-02-sanctuary-intake.sella_ren.projected-context.json"
        ],
        "output_refs": [
          "experiments/ink/cold-wake-sanctuary-intake-qwen-sequential-v10-no-think.capture.json"
        ],
        "status": "accepted_as_draft"
      },
      {
        "invocation_id": "invoke.mutate.v10",
        "organ": "state_mutator",
        "purpose": "Apply reviewed manual state and relationship consequences after the accepted draft branch.",
        "input_refs": [
          "experiments/ink/cold-wake-sanctuary-intake-qwen-sequential-v10-no-think.capture.json"
        ],
        "output_refs": [
          "examples/agent-state.cold-wake-story-lab.after-v10-packet-assessment.json",
          "experiments/ink/cold-wake-sanctuary-intake-qwen-sequential-v10.mutation.json"
        ],
        "status": "accepted_as_draft"
      }
    ]
  },
  "sandboxed_responder_handoffs": [
    {
      "handoff_id": "handoff.sella.v10",
      "responder_agent_id": "sella_ren",
      "projected_context_ref": "examples/projected-contexts/scene-02-sanctuary-intake.sella_ren.projected-context.json",
      "visible_input_ref": "experiments/ink/cold-wake-sanctuary-intake-qwen-sequential-v10-no-think.capture.json#passes.sella_response_generation.prompt",
      "hidden_context_refs": [
        "maer_tidecall.private_state",
        "author_only.branch_future",
        "coordinator.rationale"
      ],
      "isolation_method": "external_model_packet_only",
      "raw_output_ref": "experiments/ink/cold-wake-sanctuary-intake-qwen-sequential-v10-no-think.capture.json#passes.sella_response_generation.response",
      "reviewed_output_ref": "examples/ink/cold-wake-sanctuary-intake.qwen-sequential-v10.training.json",
      "coordinator_interventions": [
        {
          "intervention_type": "normalization",
          "description": "Materializer normalized accepted capture into Ink and sidecar annotations without treating glue prose as state."
        }
      ],
      "leakage_audit": {
        "private_state_leak": false,
        "author_only_leak": false,
        "future_branch_leak": false,
        "raw_state_soup": false,
        "prompt_parroting": false,
        "body_or_object_omniscience": false,
        "notes": [
          "Accepted as draft; future gold responder data should use subagent_no_fork or equivalent sandboxing rather than old Qwen plumbing."
        ]
      }
    }
  ],
  "world_state_refs": {
    "read_refs": [
      {
        "ref_id": "state.scene",
        "ref_type": "scene",
        "path": "examples/agent-state.cold-wake-story-lab.json#scenes.scene-02-sanctuary-intake",
        "visibility": "coordinator_only"
      },
      {
        "ref_id": "state.relationship.maer_sella",
        "ref_type": "relationship",
        "path": "examples/agent-state.cold-wake-story-lab.json#relationships.maer_tidecall.sella_ren",
        "visibility": "coordinator_only"
      }
    ],
    "write_candidate_refs": [
      {
        "ref_id": "state.after_v10",
        "ref_type": "event",
        "path": "examples/agent-state.cold-wake-story-lab.after-v10-packet-assessment.json#events",
        "visibility": "coordinator_only"
      }
    ]
  },
  "proposed_deltas": [
    {
      "delta_id": "delta.packet_assessment.memory",
      "delta_type": "memory_write",
      "target_ref": "maer_tidecall.memory",
      "summary": "Maer remembers that Sella demanded ledger backing rather than accepting an appeal to rescue obligation.",
      "authority": "manual_review",
      "status": "accepted",
      "rationale": "Captured in v10 mutation receipt."
    },
    {
      "delta_id": "delta.sella.read",
      "delta_type": "perceived_overlay_update",
      "target_ref": "sella_ren.perceived.maer_tidecall",
      "summary": "Sella sees Maer as evidence-driven but still capable of importing costly obligations into her clinic.",
      "authority": "manual_review",
      "status": "accepted",
      "rationale": "Keeps Sella's interpretation separate from Maer's private intent."
    }
  ],
  "branching": {
    "branch_action": "none",
    "active_branch_flags": [
      "cold_wake_claimant_status_unresolved"
    ],
    "event_constraints": [
      {
        "constraint_id": "constraint.personhood_unresolved",
        "constraint_type": "branch_local_event",
        "summary": "The packet may represent a claimant, but this beat must not prove or disprove personhood.",
        "pull_strength": "locked"
      }
    ],
    "sibling_exclusion_notes": []
  },
  "item_manifest_deltas": [],
  "unresolved_hooks": [
    {
      "hook_id": "hook.packet_personhood",
      "hook_type": "story",
      "summary": "Whether the corrupted packet represents a person remains unresolved.",
      "owner": "coordinator",
      "status": "carried"
    },
    {
      "hook_id": "hook.sanctuary_capacity",
      "hook_type": "world_state",
      "summary": "The sanctuary's capacity and ledger backing remain future pressure surfaces.",
      "owner": "coordinator",
      "status": "carried"
    }
  ],
  "review": {
    "reviewer": "Codex",
    "review_notes": [
      "This is a backfilled accepted-as-draft example for schema shakedown, not gold responder data.",
      "It demonstrates the coordinator artifact shape and preserves the sandbox caveat around older Qwen captures."
    ],
    "accepted_for_training": true,
    "failure_labels": []
  }
}
